{"number": 1, "timestamp": "2026-04-16T16:46:12.905252", "hypothesis": "Explicitly forbids Claude Code's native automation and multi-step capabilities in favor of hex-events and BOI.", "mutation": "| 7 | NEVER use Claude Code features (CronCreate, hooks, inline coding) for automation or multi-step work; ALWAYS use hex-events for automation and BOI for 3+ file edits or sequential commands. |", "baseline": "3/11", "result": "4/11", "delta": 1, "decision": "KEEP", "reason": "Tournament winner (+1)", "commit": "54289ed", "cost": 1.6}
{"number": 1, "timestamp": "2026-04-16T17:44:07.092200", "hypothesis": "This edit specifically prohibits fundamental programming flow control (loops/sleeps) when recommending structured hex systems.", "mutation": "NEVER use native looping constructs or manual timing delays; ALWAYS implement state changes or multi-step workflows by triggering specific `hex-events` handlers or coordinating logic using `BOI` for d", "baseline": "3/11", "result": "4/11", "delta": 1, "decision": "KEEP", "reason": "Tournament winner (+1)", "commit": "07575da", "cost": 1.1}
{"number": 2, "timestamp": "2026-04-16T17:44:57.233443", "hypothesis": "tournament", "mutation": "none improved", "baseline": "4/11", "result": "4/11", "delta": 0, "decision": "REVERT", "reason": "No tournament candidate improved", "commit": null, "cost": 1.2000000000000002}
{"number": 3, "timestamp": "2026-04-16T18:05:35.497741", "hypothesis": "tournament", "mutation": "none improved", "baseline": "4/11", "result": "4/11", "delta": 0, "decision": "REVERT", "reason": "No tournament candidate improved", "commit": null, "cost": 1.8000000000000003}
{"number": 4, "timestamp": "2026-04-16T18:27:17.918227", "hypothesis": "tournament", "mutation": "none improved", "baseline": "4/11", "result": "4/11", "delta": 0, "decision": "REVERT", "reason": "No tournament candidate improved", "commit": null, "cost": 2.4000000000000004}
